{"$schema":"https://json-schema.org/draft/2020-12/schema","title":"Activities","type":"array","items":{"type":"object","required":["destination","name","description","duration","price","reservationStatus","difficulty","tips","photoKey"],"properties":{"destination":{"type":"string"},"name":{"type":"string"},"description":{"type":"string"},"duration":{"type":"string"},"price":{"type":"string"},"reservationStatus":{"type":"string"},"difficulty":{"type":"string"},"tips":{"type":"array","items":{"type":"string"}},"photoKey":{"type":"string"}}}}
