[
  { "destination": "Bangkok", "name": "Día de templos históricos", "description": "Ruta por Grand Palace, Wat Pho y Wat Arun.", "duration": "6-8 h", "price": "25-40 EUR", "reservationStatus": "Abierto", "difficulty": "Fácil/media por calor", "tips": ["Vestir con recato", "Empezar temprano", "Llevar agua"], "photoKey": "bangkok" },
  { "destination": "Chiang Mai", "name": "Santuario ético de elefantes", "description": "Visita de día completo sin montar elefantes.", "duration": "6-8 h", "price": "60-90 EUR", "reservationStatus": "Pendiente", "difficulty": "Fácil", "tips": ["Verificar política de bienestar animal", "Llevar ropa de cambio"], "photoKey": "chiang-mai" },
  { "destination": "Koh Tao", "name": "Buceo / bautismo", "description": "Bautismo o fun dive según certificaciones.", "duration": "4-5 h", "price": "80-120 EUR", "reservationStatus": "Pendiente", "difficulty": "Media", "tips": ["Revisar formulario médico", "Confirmar seguro de buceo"], "photoKey": "koh-tao" },
  { "destination": "Phi Phi", "name": "Maya Bay + Pileh Lagoon", "description": "Tour en barco por los clásicos de Phi Phi.", "duration": "4-6 h", "price": "45-70 EUR", "reservationStatus": "Pendiente", "difficulty": "Fácil", "tips": ["Ir temprano", "Comprobar restricciones de temporada"], "photoKey": "phi-phi" }
]
